user,time,rating,content
mooc36096106730367324,发表于 2024-12-18,5,"i think it is one of the best python teaching courses, espically considring that i am an international students. i think even 5 stars is not enough for the course. even the way the teacher teaches is amazing."
mooc36205155603303845,发表于 2024-12-18,5,"I learned a lot of new things from this site and the teacher did a good job,I think it is the best sourse to learn python"
mooc198883955252325975,发表于 2024-12-18,5,Awesome course. It helped me so much that i can't describe in words.Thank you for launching such a wonderful course.
mooc198208429933143004,发表于 2024-12-15,5,特别特别好，非常非常喜欢
王宇晴T2022207143,发表于 2024-11-28,5,TAIHAILEBA
牛星晢,发表于 2024-11-26,5,非常有收获
学员3cd8kada77233726854117714,发表于 2024-11-09,5,老师都很好，讲的很详细
22大数据与会计1班张艳萍,发表于 2024-11-07,5,非常好的课程
Cookiek1234160399397997971,发表于 2024-11-06,5,老师讲的非常认真细致 很有耐心 也收获了很多关于python的知识 能用到生活和学习中 给老师点赞！
不要看我不要看我,发表于 2024-11-01,5,非常不错的课程，学习效果丝毫不比线下课得效果差，老师线上回复十分及时，快速上手Python简直不要太爽，可视化的学习也是对Python语言理解的加深，更深一步理解了市面上各种各样的优美的数据大屏的来源和制作方法
北野k1231531573056873261,发表于 2024-11-01,5,上了李老师的课，才深切感受到什么叫高质量教学。老师不仅专业知识极其渊博，对课程里的每个细节都了如指掌，还能旁征博引，结合很多实际案例来讲授理论知识，这使得那些原本枯燥的内容一下子变得生动有趣起来。老师的教学方法也很灵活多样，小组讨论、课堂练习等环节让我们有更多机会去实践运用所学，大大提高了我们的学习效果。这门课程让我对这个学科有了全新的认识和浓厚的兴趣，非常感谢老师！
mooc31706497253270243,发表于 2024-11-01,5,有很多爬取技术，很好玩，推荐学习
明日晋升斗帝,发表于 2024-11-01,5,好好好好好！
mooc130394985024705539,发表于 2024-11-01,5,内容有趣丰富
君踏桃花归k1296241038960562306,发表于 2024-11-01,5,好！！！！！
小陈同学abc,发表于 2024-11-01,5,不知道该怎么评价更有趣，爬虫真的是一个很有趣的项目，有趣的老师有趣的题目，上课就像在跟老师交朋友，不论是谁都可以爱上这门课程
mooc138757176804355418,发表于 2024-11-01,5,verygood
mooc28870941770402515,发表于 2024-11-01,5,老师讲的太好了吧，人美又温柔，耐心解决问题，我学会了，yyds
清平乐.k1231533229820845974,发表于 2024-11-01,5,必须给李老师的课程点个大大的赞！老师在讲课时充满激情，这种热情很容易就感染了我们，让我们也能全身心地投入到学习当中。课程的课件制作精良，重点突出，一目了然，配合老师生动的讲解，让我们能更好地把握关键知识点。老师还特别耐心，对于同学们的疑惑总是不厌其烦地解答，直到大家都明白为止。在这门课里，我学到了很多宝贵的知识和技能，真的很幸运能遇到这样一位优秀的老师！
我是熊憨憨,发表于 2024-11-01,5,课程内容丰富，非常有趣
mooc147234896965856452,发表于 2024-11-01,5,老师授课时重点突出，合理使用各种教学形式，比如在重点讲解某一部分时，为了能够确保学生听懂，充分利用黑板推理，演算比较清晰，易于让学生接受的特点
mooc97275926301305676,发表于 2024-11-01,5,老师讲课超级有趣，性格超级好，讲的知识很清晰很容易理解，为老师打call
McAlister,发表于 2024-11-01,5,太好了，学到了很多有用的东西
fahaxikizl,发表于 2024-11-01,5,这课哪里无聊了 这课可太棒了
k1265476146274770097,发表于 2024-11-01,5,我最近参加了一门大数据爬虫课程，体验感超棒，必须要给一个大大的好评！ 课程内容丰富且极具专业性。从爬虫的基本原理开始讲起，逐步深入到各种复杂的爬取场景和技术应用。无论是对于初学者还是有一定基础的人来说，都能在课程中找到自己的提升点。对于像我这样对大数据爬虫领域感兴趣但又不知从何下手的人来说，这门课程就像是一盏明灯，照亮了我前行的道路。 授课老师非常专业且富有耐心。在讲解过程中，老师能够用通俗易懂的语言把复杂的概念解释得清清楚楚。遇到学员的问题，总是及时、耐... 更多
一川k12110000814499920926,发表于 2024-11-01,5,太棒啦！这是我上过最好的课程，老师幽默风趣，干货满满，真的太爱啦！
mooc31542375764292219,发表于 2024-11-01,5,老师讲的不错
mooc97211907587122256,发表于 2024-11-01,5,好，非常好，好爆了
mooc145407637344442104,发表于 2024-11-01,5,老师美丽又风趣，还能教我们爬小说
郑晨k12112480780150031074,发表于 2024-10-28,5,很棒的课程 受益匪浅
mooc118610668598592705,发表于 2024-10-26,5,老师讲的太棒了，受益匪浅
mooc97273874515105714,发表于 2024-10-26,5,老师的课太有趣了！！！学到了超级多知识!
mooc97273971373922647,发表于 2024-10-26,5,老师的课太有趣了！学到了超级多的东西，老师教的非常有趣！
学员4a99kada97975457451149216,发表于 2024-10-26,5,老师很好，课程很有意思，易懂
苏睆白,发表于 2024-10-26,5,老师讲的非常好，对知识点讲的很透彻，通俗易懂！
一个debu罢了,发表于 2024-10-26,5,老师课讲的非常通俗易懂，让我对于这方面的知识有了很多了解，非常的有用的一个课程
秋日私语。,发表于 2024-10-26,5,老师教的很有用
