comment_id,user_nickname,content,agree_count,mark,gmt_modified
6808699,mooc96231229033660588,很实用，老师讲得很好,0,5.0,1710311344691
6806733,南华大学机类2113王超群,非常好，非常好，很有用，实现小说自由了。,0,5.0,1710311335950
6806732,mooc10792166619199946,very good，幽默，和蔼可亲,0,5.0,1710311315394
6807714,mooc65483812775398348,这门课通俗易懂的给初学者提供了入门的知识基础,0,5.0,1710311296290
6811625,🇨🇳初忆浅絔,好课，老师温柔可爱，课程内容有趣不无聊,0,5.0,1710311254368
6804807,BYD606,太好啦太好啦,0,5.0,1710311252381
6806731,*k1228878483467566605,老师讲课非常细致，全面。我受益良多,0,5.0,1710311248242
6808698,FLIPPED txt,超有意思的课(●—●),0,5.0,1710311243658
6808697,mooc10728226043531753,goodgood,0,5.0,1710311223003
6805774,mooc161338350663266888,老师上课幽默风趣，我很喜欢，希望以后还能上老师的课,0,5.0,1710296264574
6811579,mooc10712805116951582,有趣有趣非常有趣，实现小说自由了,0,5.0,1710290456687
6806687,李智通20210010420,觉得这门课里教的技术比较实用，在生活里也有很多地方可以用上，比平时一个个数据去抓，效率提高不要太多,0,5.0,1710290428107
6811578,想她想到手起茧,觉得这门课很实用，尤其是导师布置的任务，可以用爬虫老师提高效率,0,5.0,1710290371204
6805756,釩，一帆风顺,老师幽默风趣，教导有方,0,5.0,1710290337276
6805755,一块五毛三,老师上课生动有趣，能积极的调动学生的情绪,0,5.0,1710290299126
6807674,mooc97324630327624881,教学非常有趣，也很有效    对我有很大的帮助,0,5.0,1710290185544
6808644,卢豫喜,老师讲课和好，很有趣,0,5.0,1710290174906
6811577,喵🐟k1210694492978993341,讲的很好，很高级，开拓了视野,0,5.0,1710290173204
6805754,mooc96244190968358812,非常好的课，收益匪浅,0,5.0,1710290141566
6809680,mooc66676573874613652,学习后对大数据时代的运作方式有了更深的了解，可能会改变我之后的工作思维。编程也不一定很难，也可以简单又有趣,0,5.0,1710290122214
6809679,mooc29679991512717037,感觉这门课很实用，可以抓一些好玩的数据，有些老师布置的任务也可以利用爬虫技术来完成，感觉很爽,0,5.0,1710290112724
6808641,mooc12002234516921311,课程生动有趣，老师讲课生动形象，我很喜欢,0,5.0,1710290034830
6808640,入梦寻伊人,李老师幽默风趣，教学经验丰富，经常给我们举很多实际生活的例子，用最通俗易懂的语言教我们比较抽象的数据读取，和学生互动性强，在她的课上可以开心的学到知识。,0,5.0,1710290032816
6810650,mooc10712841485838423,确实挺不错的，你们觉得怎么样,0,5.0,1710290027812
6804770,mooc97275908126740223,课堂生动有趣，老师上课十分认真负责,0,5.0,1710290023594
6809678,学员0c98kada107686334437934858,课程有趣，可以学习到有趣的爬虫知识，老师讲课方式生动形象！,0,5.0,1710290023137
6804769,mooc132280647923573936,老师上课风趣幽默，知识点丰富。推荐大家都来听一听学习一下,0,5.0,1710290017546
6811576,mooc158210215500710201,老师上课很有意思。内容易吸收。,0,5.0,1710290016716
6809677,吴雪亮,老师讲得非常精彩，上课充满乐趣,0,5.0,1710290014491
6804768,mooc10694521098732151,讲得很好 学到了很多 很好很有趣,0,5.0,1710290006614
6811574,郎文硕FingerStyle,已经完全实现小说自由，可惜拘留所不能看手机,0,5.0,1710290006226
6811573,mooc133681117595564401,好好好，通俗易懂,0,5.0,1710289997442
6811572,机械2101王德意,该课程设计合理，内容深度适中，既注重基础知识，又注重实践能力，是一堂非常优质的课程。,0,5.0,1710289995749
6804766,邦1114,很棒的课程！,0,5.0,1710289992341
6809676,mooc173392415663694805,李老师讲课生动有趣，能学到非常多的知识,0,5.0,1710289980979
6809675,mooc150811466030217845,上课认真幽默风趣,0,5.0,1710289977559
6805753,mooc10601708997678572,好好好好好,0,5.0,1710289969324
6807672,mooc97193703699341825,课程内容非常有趣，保姆级教程！！！,0,5.0,1710289938331
6811571,周小皖,很不错，值得学习,0,5.0,1710289927006
6809674,学员6acbkada28755311694660243,教师基本功扎实，学问讲解精确，教学设计合理，始终以学生为主体，自主学习，小组交流争论，上台交流展示等形式，师生协作默契，取得了较学习效果。,0,5.0,1710289925814
6808639,你也听说过我的故事吗,1、饭量充足，价格也非常合理，下班不想做饭，就马上点了这个外卖，果然像好评一样，很合口味。 包装很好，里里外一滴也没滴，送也及时，要表扬。,0,5.0,1710289868549
6810649,mooc10776716769239872,课程很棒，学到了很多东西,0,5.0,1710289846677
6809673,mooc81508109629445936,老师讲的很好,0,5.0,1710289842530
6804763,清微道妙真君,确实很不错,0,5.0,1710289768476
6810648,mooc51691192952242449,上课活泼，互动引人入胜,0,5.0,1710289664258
6808637,mooc97211791898438052,非常认真负责,0,5.0,1710289540804
6808636,Yanko257,老师讲课重点突出、授课条理清晰、认真负责、严谨、耐心、资料丰富、涉及资料十分广泛。课堂气氛很好，总是能把授课资料和社会实际结合起来，授课资料通俗易懂。,0,5.0,1710289536949
6810646,大陌啊,好好好好玩,0,5.0,1710289452635
6807665,mooc65413881207566270,老师讲的很好,0,5.0,1710289421660
6810644,mooc10776563346245227,好的课程，使我受益匪浅，心情愉悦；开拓了我的视野，补充了我的网络知识,0,5.0,1710289414207
6807664,热意mooc65475460765893214,讲的很好，内容丰富,0,5.0,1710289371227
6810642,mooc10776617211099354,好好好好好,0,5.0,1710289363599
6804760,mooc109728986438328447,老师上课讲的知识很详细，很细致，很容易理解，老师上课幽默有趣，能调动学习气氛,0,5.0,1710289357181
6810639,mooc117311001254207080,老师讲的很好,0,5.0,1710289348563
6805744,李景朝,讲解内容清晰易懂,0,5.0,1710289338082
6808634,VAN螺,学到了很多,0,5.0,1710289331048
6805743,mooc97192943033404552,好，非常好,0,5.0,1710289275506
6805737,mooc10828669924715155,有趣并且实用,0,5.0,1710288851337
6810631,mooc173392389556635075,内容充实，学到很多实用的知识,0,5.0,1710288842089
6752766,ฅ ̳忆梦ฅ,无意发现了这个课程很符合我获取论文数据的需要，于是我便学了一遍。这节课程对我帮助最大的便是我想获取的数据资源是一个动态网站上面的，但是我在获取的时候一直报错，显示502错误。没看课之前我只知道我被反爬虫了，网上很多教程大多是教我们修改浏览器的一些选项，我试了但是都达不到最终效果。后面在课程中我了解到可以通过header头模拟浏览器ip用户，让浏览器在获取动态数据的时候不会被识别出来从而被拦截。通过这个课程的学习我成功解决了论文数据获取的大问题，因此我很感谢这个课程给我带来的收获感谢李晓昀老师。,0,5.0,1705843665483
6751728,五河今心,最近正好在弄毕设，数据准备需要自己写爬虫，又有一段时间没写忘得差不多了，正好看了这个课程当做复习。跟着模块2、4、5、6又学了一次，正好把要爬的资源爬下来了。老师讲得简单易懂，省了很多时间，爱了爱了,0,5.0,1705839260187
6751721,mooc82957876383233136,老师讲得特别好，知识点都讲的很透彻，课程也不乏味，很有意思，我在课上学到了很多关于Python的知识，非常推荐这个课程。,0,5.0,1705828493713
6749701,mooc120526370477528434,非常好，老师讲的非常到位,0,5.0,1705824981998
6751713,春阔,这门Python数据处理及可视化MOOC课程是一门系统而实践性强的课程，适合希望通过Python进行数据处理和可视化的学习者。课程内容全面，从基础的Python语法开始，逐步深入到数据处理常用库如Pandas和Matplotlib的使用，再到数据可视化的进阶技巧，都有详细的讲解和实操示例。教师讲解清晰，习题和实践项目的设计有助于巩固知识点，提高实际操作能力。此外，课程还紧跟当前数据处理和可视化的热点，介绍了最新的技术和工具，使学习者能够与时俱进。,0,5.0,1705822291178
6751712,小海不听话,这门Python数据爬取及可视化MOOC课程是一个全面而深入的学习平台，旨在教授学生如何利用Python进行数据处理和可视化。通过这门课程，学生可以学习到如何使用Python的各种库和工具，如NumPy、Pandas、Matplotlib等，进行数据处理、分析和可视化。课程内容丰富，涵盖了许多实例和实践，帮助学生更好地理解和掌握相关知识。此外，课程还介绍了数据采集、爬虫技术以及如何构建数据可视化界面等高级主题。,0,5.0,1705821819371
6748730,mooc7534210597061717,这门Python数据爬取及可视化MOOC课程是一个全面而深入的学习平台，旨在教授学生如何利用Python进行数据处理和可视化。通过这门课程，学生可以学习到如何使用Python的各种库和工具，如NumPy、Pandas、Matplotlib等，进行数据处理、分析和可视化。课程内容丰富，涵盖了许多实例和实践，帮助学生更好地理解和掌握相关知识。此外，课程还介绍了数据采集、爬虫技术以及如何构建数据可视化界面等高级主题。,0,5.0,1705821672556
6755702,kingbili,课程内容比较详实，老师讲的挺好的，而且不会的都会耐心回答，希望以后能学习到这么好的课程,0,5.0,1705821607259
6728197,mooc79490447441358208,真的nice,0,5.0,1705373198583
6732614,123864846,我分数了？,0,1.0,1705227705452
6690433,唐婧。。,这个课很好,0,5.0,1704078387491
6685408,23级机类20贾秀林,11111121,0,5.0,1704015583323
6684408,mooc442667503520273,nogood,0,1.0,1704013595407
6658975,20230011625李琮,555555,0,5.0,1703600751316
6625588,瑾云yy,很好的课 同学推荐的 有时间系统学习，一起努力！,0,5.0,1702997667877
6625311,mooc103350544535085597,讲的真的很好，超赞的,0,5.0,1702975262220
6623914,Winnerlcc,excellent,0,5.0,1702970445958
6623014,跨沈航软件2301吴克栋,牛牛牛牛牛,0,5.0,1702968616708
6623007,mooc103348768739461926,上了老师的课我醍醐灌顶豁然开朗受益匪浅，相信我期末一定不会挂科,0,5.0,1702968120204
6618170,mooc129516875328688397,李老师嘎嘎嘎嘎嘎嘎嘎嘎嘎嘎嘎嘎嘎好的课，力推，如果可以老师可以l我一把嘿嘿,0,5.0,1702967880626
6624257,刘旭2304,真的非常好！老师特别有实力！,0,5.0,1702967876986
6625210,mooc189197551254148,课程内容优,0,5.0,1702967786482
6621041,学员a0f9kada119278002691959135,专业知识掌握非常到位,0,5.0,1702967785538
6625209,mooc173768214334975955,"Python课程的学习内容非常丰富和全面。课程从基础的语法和语义开始讲解,逐渐深入到面向对象编程、函数式编程、数据结构和算法等高级主题。通过这门课程的学习,我对Python语言的各个方面有了更加深入的了解。课程内容的设置合理,循序渐进,使我能够逐步掌握Python的知识。",0,5.0,1702967779991
6618166,毛海茂,太好了，我太喜欢了,0,5.0,1702967774006
6622007,mooc161314587480862701,very good！实在完美！,0,5.0,1702967709042
6623875,许占涛,老师讲的浅显易懂，非常适合计算机基础不好的！！！,0,5.0,1702967648990
6624254,mooc161315299952712573,李老师，不仅讲的仔细，并且语气很温柔，人很温柔，而且课后还会积极的为我们解答！大爱李老师！,0,5.0,1702967627624
6618162,南宫-北冥,好好好，讲的很好，老师讲的很清晰，能明白自己的问题ヾ(❀^ω^)ノﾞ,0,5.0,1702967574612
6620114,谁打我jiojio,教师口才很棒，让人通俗易懂，课程质量精良，真的强烈推荐,0,5.0,1702967566838
6623873,ndndnsm,"Python这课程非常好，讲的很详细，很适合学生
学习",0,5.0,1702967542782
6623872,1120宇龙,good ,0,5.0,1702967532691
6618161,mooc92981390879265502,很好好好好,0,5.0,1702967529105
6622992,mooc161314943304678175,666666,0,5.0,1702967525618
6621030,mooc103350492490241769,这个课真的好！赞,0,5.0,1702967525164
6621029,mooc129516788515868619,老师非常专业啊，这么好的课都来加啊,0,5.0,1702967504427
6623869,mooc92981220005578164,"print（""确实挺不错的""）",0,5.0,1702967486208
6618159,lhcccc,课程内容丰富,0,5.0,1702967484304
6618155,617l,python 教学内容丰富，讲解清晰，教学方式灵活多样，课堂氛围活跃，激发兴趣,0,5.0,1702967468337
6621021,mooc190795729667209,老师教得非常好\^O^/,0,5.0,1702967464296
6618154,mooc92981852034392061,温柔的老师讲课就是不一样，质量杠杠滴,0,5.0,1702967461580
6622985,mooc92980844835076053,Python课程非常好，有助于我学习计算机语音,0,5.0,1702967458929
6625202,学员d0ebkada127802139785142500,老师教的非常好，学习氛围很好，很满意的一次学习，祝老师越教越好。,0,5.0,1702967452599
6624238,mooc191095335693449,老师讲得非常好,0,5.0,1702967450130
6623864,松松垮垮收缩自如,非常清楚 受益颇盛,0,5.0,1702967445159
6621995,mooc92979068781322022,非常棒，太好了。,0,5.0,1702967436603
6622982,yy00731,很好，很有精神,0,5.0,1702967434552
6624234,中二病的小二,太棒了，Python是一门好程序,0,5.0,1702967427431
6618147,开袋即食kada120210197737642057,这门课程特别好，值得学习。,0,5.0,1702967419891
6621018,mooc92981438164071441,满分！必须满分！,0,5.0,1702967401233
6623854,mooc173765688207236366,好好好好好,0,5.0,1702967398825
6619198,nidk12129516723817828273,老师讲的贼好，干就完了。,0,5.0,1702967384902
6623852,mooc161314990266056812,非常好的嘞。,0,5.0,1702967380604
6622977,mooc12951718749260,老师非常棒，很好的课程,0,5.0,1702967374063
6620099,mooc173767952360090935,讲的太好了,0,5.0,1702967363727
6620098,mooc161315215010135001,老师讲的很好,0,5.0,1702967360522
6620097,mooc129516584453491459,学习感觉很好，知识量丰富且学习后有许多收获。,0,5.0,1702967347224
6622975,紫翼龙鹰,老师讲课生动有趣，带我们走进爬虫，让我又对计算机提起了兴趣(/≧▽≦)/~┴┴ (开心起来掀个桌没毛病吧～),0,5.0,1702967336204
6618143,mooc161314666743933187,老师讲得很细节,0,5.0,1702967335329
6624229,mooc161314951213043409,很有用学到很多知识,0,5.0,1702967316032
6622974,mooc173766150945455882,非常不错，讲的很好！！,0,5.0,1702967314542
6618141,半江残叶::][::,课程质量很好,0,5.0,1702967286148
6619195,mooc153376920524099254,清楚，清晰，明了，生动，形象,0,5.0,1702967269267
6621985,Fjoeodjrhtkskehjtfooefsdjdjdi,老师讲的也太棒了吧,0,5.0,1702967255581
6621984,mooc161314782491146678,讲的非常好，通俗易懂，一看就会了。,0,5.0,1702967253640
6619194,mooc103350431162420460,一学就会，讲的太好了,0,5.0,1702967246324
6621012,超k12157949123786075974,老师讲的真好,0,5.0,1702967225104
6620089,mooc161315494066148884,简直太棒啦,0,5.0,1702967167651
6620471,mooc92891634753602786,老师讲的真不错,0,5.0,1702884264262
6616612,mooc92894336374019688,牛！哈哈哈哈(✿^‿^),0,5.0,1702881524609
6617560,mooc129430292178058110,老师讲的很好，而且问的时候回答的也很耐心,0,5.0,1702881386179
6617557,AAA李吉奇,真的爽，太爽了，老师nb了，听了之后豁然开朗,0,5.0,1702881291761
6619455,mooc103263354121856885,老师很不错,0,5.0,1702881265123
6618574,窗外x,本课程还是OK的,0,4.0,1702881224198
6622346,mooc92891540695563919,老师讲得太好了,0,5.0,1702881218448
6622344,mooc173681265951679959,老师讲解耐心细致,0,5.0,1702881187313
6616603,网恋秀牛被录屏,爬虫很有用啊,0,5.0,1702881146359
6616601,机类2306王茂玺,goodgoodgood,0,5.0,1702881137061
6616598,天道超哥,好好好，不愧是老师,0,5.0,1702881124131
6619445,mooc104321934689486,爬虫泰酷辣！！！,0,5.0,1702881123694
6623203,mooc161228117597404285,good。,0,5.0,1702881117819
6617549,mooc92894633740465545,老师讲得太好辣，对爬虫很有兴趣！爬虫很有实际作用呢，泰裤辣,0,5.0,1702881117498
6619440,mooc92894482690578035,上课速度适中，讲课内容高效，负责，有趣，,0,5.0,1702881060409
6616593,mooc92894949553118187,非常好的老师，教育非常好，十分擅长爬虫。,0,5.0,1702880981676
6617545,起k12173678633771812578,学懂后，好玩不亚于建模,0,5.0,1702880975103
6623201,mooc129427156689249131,哟西中国有句古话，叫做西西捂者为菌杰,0,5.0,1702880969589
6616200,mooc92891638331798283,非常非常好,0,5.0,1702880922980
6616198,mooc129429817939000841,受益良多，继续学习,0,5.0,1702880909773
6616197,周广权,"非常好，非常好，非常好课程名称：Python编程基础与应用
评价内容：
1. 教学内容：本课程介绍了Python编程语言的基本语法、数据类型、控制结构、函数与模块、面向对象编程等知识点。课程内容系统全面，由浅入深，使学生能够掌握Python编程的基本技能。
2. 教学方法：课程采用线上线下相结合的方式，教师讲解与实例演示并行，引导学生动手实践、主动思考。此外，课程还设置了丰富的课后练习和项目实践，让学生在实际操作中提高Python编程能力。
",0,5.0,1702880909151
6617542,mooc1254523335754,好，很好，非常好，特别好。,0,5.0,1702880900483
6617539,2023栾嘉辉,老师讲解清晰富有耐心，知识分析透彻，让本来毫无接触的我有了新的层面,0,5.0,1702880895048
6620435,mooc103861349601126,老师的课一直是开卷有益,0,5.0,1702880890779
6620434,Shligbs,真的，老师好，课好，不多说，yyds,0,5.0,1702880885835
6621361,AhHiko,李老师太强了,0,5.0,1702880874577
6621359,夢を描くk12150313121677767528,南华大学最好的计算机教授之一开的课程，含金量无需多说，学了一定会有收获 :),0,5.0,1702880870695
6621358,mooc129426996588963098,女子女子女子女子女子,0,5.0,1702880866813
6618558,张清城-,Good !,0,5.0,1702880858497
6616193,mooc129429753213099341,老师讲得很好很清楚,0,5.0,1702880856551
6616191,mooc129429814558337569,真的非常好 人性化,0,5.0,1702880844637
6622332,mooc103260726327638645,在美国的五星上将麦克阿瑟将军曾说：这是我上过的最好的计算机课程。,0,5.0,1702880844378
6620431,mooc92894306181147308,这课真不错呀，老师真棒,0,5.0,1702880843869
6616584,mooc92892649301837408,非常好，老师讲的很生动。,0,5.0,1702880843633
6616190,mooc101099302276044,好好好好好好好,0,5.0,1702880841477
6617535,机类2308班黎梓浩,讲得雀食不错,0,5.0,1702880840270
6619434,mooc173678706469220364,这太酷了吧,0,5.0,1702880839278
6616583,mooc173681192357745244,这真是一门令人难以置信的课程！我对课程内容充满了浓厚的兴趣，每一节课都让我收获满满。老师以其深厚的专业知识、生动有趣的授课方式和严谨的教学态度，让我对这门课程有了更深入的理解和热爱。此外，老师总是鼓励我们积极参与课堂讨论，使我在思考问题时更加全面和深入。这门课程让我感受到了学习的乐趣，也使我在专业领域取得了很大的进步。总之，我非常感谢老师为我们提供了这样一门优质课程，让我在学术道路上更进一步。,0,5.0,1702880832565
6619433,lynb,给老师来个五星好评，老师能不能交我们心形代码,0,5.0,1702880831876
6620429,mooc92891648183651131,非常的实用,0,5.0,1702880828276
6620428,夏羲喆,当爬虫？当爬虫！！！,0,5.0,1702880827730
6616582,mooc129427055950637504,十分实用，对我的学习很有帮助,0,5.0,1702880825763
6618555,李佳超1,非常nice。,0,5.0,1702880821860
6617531,mooc103263361852053353,五星好评。,0,5.0,1702880806502
6616187,mooc92891661289520188,这是一门非常好的课目，教会了我们如何获取免费的小说和音乐,0,5.0,1702880804794
6522819,忘了ykt1448772168406,好好好很好很好,0,5.0,1700756264448
6498185,哈哈月n,学习到了更多编程的知识,0,5.0,1699958614268
6349067,mooc67402941737763156,泰裤辣，就喜欢这样的老师,0,5.0,1695804434665
6350026,mooc67151409501413811,认真负责，课程优秀,0,5.0,1695804086482
6350025,千都世理子,给孩子看完了，孩子很爱看,0,5.0,1695804009722
6351447,鲜重.,老师教学非常细心,0,5.0,1695804004417
6351446,mooc79488964107933585,老师语言清晰，逻辑通顺，讲的很好,0,5.0,1695803988495
6352430,尘埃落定k1266853574146935974,课程内容丰富多彩，跟学生的实力情况贴合，实用性很强！,0,5.0,1695803980835
6347054,梓煦k1235055282240370708,老师讲的很认真很细节易懂，通过这门课程我学到了很多东西。,0,5.0,1695803968016
6350024,李仕勳,"李老师讲的课通俗易懂，我喜欢上了Python,以后自己也会更加深入的了解学习这项技能,感谢老师 。
",0,5.0,1695803966810
6351445,mooc97651453237926412,课程丰富有趣，能够调动我们的激情，同时老师课程内容干货满满,0,5.0,1695803965395
6353389,mooc67052634173315313,"老师工作勤勤恳恳，扎扎实实脚踏实地地做好一个教师的本职工作，认真完成教学任务
教学水平高,非常推荐",0,5.0,1695803960571
6351022,王煜榛,老师教学质量高，讲的内容细致清楚，非常容易上手,0,5.0,1695803957257
6349064,转圈化简-,非常好!!!讲课非常细致，很生动，收获很多。,0,5.0,1695803956202
6347053,文武001,非常好课程，教会了我许多关于python的知识和操作，老师也非常风趣幽默，课堂氛围十分良好,0,5.0,1695803955455
6353388,mooc6007415172980813,课堂内容清晰，老师认真负责，学习收获很多，对于计算机方面内容尤其python语言有了新认识,0,5.0,1695803939280
6351444,Stephenk1266074114340371740,老师讲的很好很棒,0,5.0,1695803916927
6351021,mooc6014379623167143,"在教学过程中，教师有一个深刻而广泛的内容，涵盖广泛，并且可以接触到古代和现代，结合时代背景，完全理解诗人的生活经历，诗人和其他古人，同时让学生更好地理解古代文学作品的内涵和意义，同时培养学生的情感，提高他们学习过程中的质量。

教学效果显著。和同学们在学好古代文学课程的同时，提高了自身的人文素质，提高了文学品位，加强了自身的修养，使学生能够在轻松、活跃的学习氛围中增长知识",0,5.0,1695803910458
6351020,mooc90563779927797960,好很好非常好太好了,0,5.0,1695803906702
6351019,向成荣清1,老师教学很风趣易懂，内容也很有干货，赞,0,5.0,1695803902906
6348057,丈k1266072208928966081,内容很丰富，学到了很多实用的知识，对我的学习、生活、帮助很大，很有意义和价值的一门课，感谢李老师耐心细致的教导，我从中学到了很多,0,5.0,1695803897684
6348056,千俞k122027848816267873,课堂生动有趣，课程被老师简化，易懂，学习效率提高了,0,5.0,1695803894089
6352429,钛袂,知识讲解详细,0,5.0,1695803893383
6349063,lyf许诺,老师介绍了很多平时接触不到的知识，让我们对这门课程有了更多了解。,0,5.0,1695803892793
6352428,张文华k1266112017696670303,爬虫课程是一门非常有用的技能，可以帮助我们在互联网上获取大量的信息和数据。通过这门课程，我学会了如何使用 Python 编写爬虫程序，掌握了网络爬虫的基本原理和技术。老师讲解清晰，课程内容丰富，让我受益匪浅。我强烈推荐这门课程给有兴趣学习爬虫的人。,0,5.0,1695803886788
6351018,万理。,李老师讲的比较细节，在不懂得地方会放慢速度。教学中比喻较为形象，让学习变得更好懂,0,5.0,1695803886781
6353387,李应k126020649673596509,"课堂思路清晰，环节紧凑，重难点突出，设计合理。学生的课堂习惯非常好，每个人都能积极的参与到课堂中,课堂效果非常好。",0,5.0,1695803885755
6351443,花开上扬:、清风拂晓,这门课程非常有趣，老师讲解清晰，内容丰富，对我的学习有很大帮助。,0,5.0,1695803885603
6348055,同焉,真的很爱听，好难得的一门听了一点都不会困的课，老师讲的也好细致好有耐心，喜欢听爱听(ゝω・´★),0,5.0,1695803882139
6348054,云上有云,这门课很好，嗯，真的很好,0,5.0,1695803875334
6347052,你的、夏天,非常好的内容，爱来自湖的南边,0,5.0,1695803869524
6351017,木~嘛,老师上课感觉逻辑好清晰，感觉太棒了,0,5.0,1695803869178
6352427,刘博宇k1266853549389086588,Python学习很有趣，老师教的也很清晰，很有收获,0,5.0,1695803866209
6348053,翦科杞,老师上课生动有趣，让我们很有学习兴趣，能学到很多东西,0,5.0,1695803864506
6347051,出门向左走,老师讲的很好，关心每一位同学，让每一位同学都听懂，有不会的老师都会当场解决,0,5.0,1695803860387
6350022,Celestial_2020,老师授课内容丰富有趣，可以学到很多知识，受益匪浅。,0,5.0,1695803858952
6352426,狗砸儿,非常非常好,0,5.0,1695803852180
6351016,开心k1265889978390238556,非常的好给老师点赞希望以后还有机会上老师的课,0,5.0,1695803851361
6350020,mooc67029188759828467,教学视频做的非常用心，老师很耐心，讲解的也非常详细,0,5.0,1695803846447
