comment_id,user_nickname,content,agree_count,mark,gmt_modified
6837393,踏浪前行k1259266768296023730,老师利用情境引导学生学习新知，学生的学习兴趣被充分激起，有许多地方值得学习。而且整堂课思路清晰，环节紧凑，重难点突出，设计合理。,0,5.0,1711158124542
6836411,邓雄瑞,老师讲的十分生动，同时做了示范，让同学们操作。,0,5.0,1711158097733
6838395,mooc96440095230479412,牛！大神一个！我佩服的五体投地,0,5.0,1711158077062
6834403,机械吴镇森,老师讲的很好，很负责,0,5.0,1711158072276
6835387,tsukik1297396509531903483,这位老师以严谨的学术态度和激情洋溢的教学风格赢得了学生们的尊敬与喜爱。他总是能将复杂的知识点以简洁明了的方式阐述清楚，使学生们能够轻松掌握。,0,5.0,1711157976531
6831409,阳光下的影k1229070237572602048,很好的一门课,0,5.0,1711157815110
6834402,逆天而行k1229061748046621384,非常好，老师讲的非常清楚,0,5.0,1711157777029
6822523,李一彤医卓04班,感觉学到了很多关于数据采集和可视化的知识,0,5.0,1710727693160
6818566,数控2001杨宇涛,老师十分善解人意，课程十分优秀,0,5.0,1710721444345
6819525,mooc138586917097968206,课程十分优秀,0,5.0,1710721389530
6816499,追枫的少年xz,还可以，蛮有趣，课程活跃，老师认真负责，,0,5.0,1710693026845
6814538,木头k1211125937533374822,课件内容非常详细老师讲的非常好,0,5.0,1710685886507
6816488,罗江琴,课程内容新颖，实用性很强，可以提高同学们的动手能力！,0,5.0,1710685752273
6818535,刘蔚泽,非常好的课程,0,5.0,1710683305918
6820483,学员90d8kada48214335976870861,老师说的很好!课程很精彩!,0,5.0,1710682015186
6816459,微信用户k1211648514975378776,整个课程的结构设计得非常合理，每个模块都有清晰的目标和详细的步骤指导。这种结构化的教学方式使得即便是像我这样的初学者也能够轻松跟上进度，并在每个环节中获得成就感，授课老师拥有深厚的专业背景和丰富的教学经验。在遇到难题时，老师总是能耐心地解答，并且提供多种解题思路，这对于培养我们独立解决问题的能力大有裨益，课程配套的学习社群非常活跃，里面有许多同样热爱数据科学的伙伴。我们可以互相交流学习心得，分享资源，这大大扩展了我的视野，也增强了学习的动力。,0,5.0,1710678788543
6814510,776583457,"《Python数据爬取与可视化》是一门非常实用的在线课程，它深入讲解了使用Python进行网络数据爬取和数据可视化的核心技术。课程内容丰富，结构清晰，涵盖了从基础的网络知识到高级的数据解析技术，再到数据可视化的整个流程。通过本课程的学习，我能够掌握如何高效地获取网络上的数据，并将这些数据转化为直观的图表和报告。
课程采用了混合教学方式，结合了自学教材、在线视频讲座和互动讨论。讲师对于复杂概念的解释非常清晰，能够引导学生逐步深入理解。在线讨论区活跃，讲师和其他学生都很乐于帮助解答问题。",0,5.0,1710678402772
6818511,mooc36995766813293140,对查找资料有帮助,0,5.0,1710678115321
6815480,学员f468kada31714076953479300,老师讲解的非常详细，上课时非常有活跃,0,5.0,1710677877996
6819460,大野狼mooc11583370484842,这门课程的质量非常高，老师讲得非常透彻，让我对所学内容有了更加全面深入的了解。,0,5.0,1710677794194
6816451,机电2033王洪武,非常非常好,0,5.0,1710677787317
6818504,1234ly,课程内容丰富，讲解详细,0,5.0,1710677750925
6819459,提拉儿米苏,上课生动形象有趣，老师讲解十分清晰，对每个同学都会指导到，保证每个同学都可以学到知识,0,5.0,1710677711260
6822450,23张昌民,课程十分有趣,0,5.0,1710677540146
6818502,mooc174130982214932883,通过python学会了如何寻址，爬取网页数据。感受到网络的奇妙！,0,5.0,1710677216526
6821467,罗江琴,跟着老师编代码，感觉超级好！,0,5.0,1710676962095
6809978,mooc96271294368946644,让我感受到了计算机的神奇和魅力，也让我有了一些关于Python知识的了解,0,5.0,1710469396465
6805082,明勿晓东,学到了很多东西，大数据爬虫获取免费小说，词云等,0,5.0,1710469350847
6806992,恶魔少爷梦幻,相当奈斯，老师讲话风趣幽默，上课很有特色,0,5.0,1710469350275
6810956,段本超,这个课程很有用，学会了在网上如何爬取数据并进行处理，给生活带来了很大的便利，以后在网上找资料就再也不用因为无法下载困扰了。,0,5.0,1710469290510
6807988,mooc10532164636458836,让我学会了很多东西，老师讲课十分清晰，课堂气氛也很愉悦，让我又掌握了一项技术,0,5.0,1710469287224
6806085,08066,该课程非常好,0,5.0,1710469254813
6806990,CBAaa,python数据爬取与可视化这门门课让我学会很多实用的技巧，我们可以用python爬取一些数据,0,5.0,1710469233790
6806083,mooc173321751574046964,老师教的干货很多，教的很仔细很有耐心感觉学到很多,0,5.0,1710469213480
6807987,mooc10623470723818182,老师很漂亮，教的也很好，很喜欢老师的这门课。,0,5.0,1710469182910
6809977,mooc65413901942761770,非常喜欢！,0,5.0,1710469172131
6809976,accompanyk1291429345848201453,老师教的很好，为我未来的就业作出了巨大提升，up！up！up！,0,5.0,1710469169750
6808937,mooc28939987546394918,让我大概入门了python这门课，学到了很多很广泛很有用的知识。让我对计算机产生了浓厚的兴趣,0,5.0,1710469139600
6811897,mooc10711544100052126,课程很有效，效率也很高,0,5.0,1710469130915
6811896,学员8169ykt79608740044686578,学到了很多新的知识，老师上课很好，对自己有很大的帮助,0,5.0,1710469110305
6809975,孰明灯三千,真的非常感谢老师可以给机会叫我们这么多东西，真的对我们收集和处理数据非常有用。,0,5.0,1710469106057
6809974,栩①ɑː,十分的实用,0,5.0,1710469095384
6806081,mooc28940022975587108,李老师通过对课程的独到深入的讲解，达到了很好的教学效果，能结合多种教学手段，使学生对知识的掌握更深刻。教学内容重点突出，教学目的十分明确，教师具有极高的专业技能。 授课方式新颖别致，激起同学们的兴趣，老师很注重互动，课堂学习氛围轻松愉快，真正达到了教学的目的要求。,0,5.0,1710469082755
6810955,星梦殇雨,学习了很多有关爬虫的知识，认识到了数据的重要性。老师的课程很有趣,0,5.0,1710469081959
6808936,小保底必歪真君,一薄昏，学到了很多，但是因为本人愚钝，还要继续消化消化知识。,0,5.0,1710469081238
6805081,k12102123350455804511,老师讲得很生动容易理解，内容实用，很喜欢这门课，也很喜欢老师的教学。,0,5.0,1710469078683
6809973,kada97002835809450374,老师讲课准备充分，干货满满。,0,5.0,1710469073574
6807984,岩穴·山水,干货满满，老师讲的简介明了，通俗易懂,0,5.0,1710469067173
6809972,周程鑫,非常好，特别有用,0,5.0,1710469065022
6805079,此号已无k1299115126403999419,老师非常好，很棒的课程！！！,0,5.0,1710469047841
6809971,学员鲸海风吹,很好，我觉得很有用,0,5.0,1710469029930
6811895,mooc96310211097271943,学完爬虫很多地方都能用上，实用。,0,5.0,1710469028141
6809970,mooc109726909391173194,好好好好好好好,0,5.0,1710469024589
6806080,mooc28878438488962884,老师讲课非常通俗易懂，清晰明白，学习内容也非常有用，感谢老师,0,5.0,1710469001433
6806079,mooc65475397973545483,老师讲课很细心，比较认真负责，上课幽默风趣，别具一格,0,5.0,1710468997869
6805078,mooc10530631581279879,不错，可以学习到很多东西，很有趣,0,5.0,1710468979928
6805077,FIVEykt103782294722551839,这真是一门非常不错的爬虫入门课程，课程老师讲解生动有趣而且肥肠详细，成功提起我深入了解爬虫的兴趣，非常推荐大家都来学习！,0,5.0,1710468976860
6805076,mooc28878601485230508,老师讲课逻辑清晰，干货满满。,0,5.0,1710468964876
6805075,SKY1111112,爬虫太有用了，而且非常有趣，感谢李老师让我了解爬虫。,0,5.0,1710468957705
6810953,廖述坷,感觉还是蛮有趣的,0,5.0,1710468957385
6806078,陈子豪kada11965042511658619,学了好多有用的东西，可以丰富自己的知识储备,0,5.0,1710468942371
6806077,mooc10532162992383765,老师讲的十分实用，让我学到了很多有用的知识,0,5.0,1710468935731
6805074,彭昱铮,老师讲的非常详细，教学风格有趣，非常值得学习，从中我学习到了不少爬虫知识,0,5.0,1710468932630
6805073,慕𝖄𝕵𝖄名,老师讲的非常细腻，在课程中学到了很多关于爬虫的知识，十分推荐。,0,5.0,1710468928578
6806987,k121518134568338,Python爬取文章功能强大，代码简洁易读。感谢老师的教学，让我轻松掌握这一技能，对数据处理更加得心应手。,0,5.0,1710468901862
6807983,库拉mooc28870616700857983,这个课对于初学者来说真的非常的合适，里面的内容特别详细，很好！,0,5.0,1710468898581
6806076,mooc吹风,收货满满，学到的特别有用。老师也特别耐心，讲课生动形象非常有趣,0,5.0,1710468898405
6807982,mooc10530595819063794,老师和蔼可亲，课程有趣实用（*＾3＾）/～☆,0,5.0,1710468884442
6806986,mooc65413874916301045,老师讲得实在是太好了，讲课生动，让我收获非常大，太喜欢这个老师了！,0,5.0,1710468867863
6811892,NIG123,课好，老师好，大家都实实在在的学到了东西，很喜欢,0,5.0,1710468863597
6807981,江州青衫君,教的很详细也很有趣，老师特别友好,0,5.0,1710468846623
6808933,mooc9624,老师讲得很好，上课很有趣。,0,5.0,1710468828856
6807979,学员e7a9kada88391287048473518,内容非常丰富多彩,0,5.0,1710468800869
6805072,ʸO華,非常好的课,0,5.0,1710468798628
6807978,mooc10705337589174182,好好好好好好,0,5.0,1710468792571
6807977,mooc10530509499489343,内容细致入微，很好理解,0,5.0,1710468787376
6805029,本23医类03班27号唐婧涵,陈老师讲课非常认真负责，有不懂的、错误的地方她会在课上帮我们一个个指出修改，老师讲课也非常生动有趣，极大的激发了我对于编程学习的兴趣。,0,5.0,1710418970977
6810908,本23医类03班27号唐婧涵,陈老师讲课非常认真负责，有不懂的、错误的地方她会在课上帮我们一个个指出修改，老师讲课也非常生动有趣，极大的激发了我对于编程学习的兴趣。,0,5.0,1710418970936
6809902,mooc12406586227203187,非常有意义，真的对我很有帮助。,0,5.0,1710408123343
6804996,23级医类02班饶大俊20230020203,老师讲的很详细，理解的很容易,0,5.0,1710407919097
6809900,野生泡面,老师讲得很详细，答疑很快也很有耐心,0,5.0,1710407892771
6809899,♬k12174022682081640004,老师讲的好,0,5.0,1710407885881
6806007,mooc11234697654869386,老师教的非常详细，有耐心。我遇到了不能解决的问题，也可以及时与老师讨论，从Python教程里我体会到了之前没有过的特殊体验。,0,5.0,1710407885638
6807904,菩小提先生,可以一起进步太棒了,0,5.0,1710407874832
6806006,不清楚呢k12174020729746798193,太好了，非常易懂的视频,0,5.0,1710407852727
6811806,mooc13675803158727025,6666666,0,5.0,1710407841536
6804995,lw5552211,老师温柔又体贴让我如沐春风，yyds，讲的也很仔细，通俗易懂。,0,5.0,1710407823220
6808852,mooc174022953258356732,无论是那些深入浅出的讲解，还是那些生动有趣的案例，都让人为之倾倒。它让我们不仅学到了知识，更让我们感受到了学习的乐趣。,0,5.0,1710407815334
6806005,本23医类2班9号汤嘉陈,作为非计算机专业的学生，我从这个里面获得了很多有用的东西，对我的启发很大，五星好评课！！！,0,5.0,1710407813917
6804994,mooc10722901400393503,老师讲的很好，每个知识点都讲得很透彻，案例贯穿整个知识路线,0,5.0,1710407813519
6804993,雨k12174023587424950928,"你的网课内容非常全面，深入浅出地讲解了复杂的概念，让我受益匪浅。你的教学方法真的很有创意，通过生动的实例和互动环节，让学习过程变得既有趣又高效。网课的技术运用非常专业，视频和音频质量极佳，让我感觉就像在现场一样。
课程的结构安排得非常好，每个章节都紧密相连，让我能够循序渐进地学习。你对学生的疑问总是耐心解答，及时的反馈让我感到非常受支持。你的课程让我对这个话题产生了浓厚的兴趣，我迫不及待想要探索更多。课程的个性化设置让我能够根据自己的进度和理解能力来学习，这对我来说非常有帮助",0,5.0,1710407811183
6807903,mooc11229846093338302,老师讲解很细致特别容易上手，有不懂的问老师，老师也是及时讲解回复,0,5.0,1710407796023
6811805,Cafunek1211588292623661261,老师们讲的真好，学习Python爬取这门课程还是挺有意思的，学习了这门技术日常生活中不仅可以更好的掌握玩转计算机，还可以给平凡枯燥的生活带来乐趣，五星好评！,0,5.0,1710407795435
6804992,学员9178kada2156157832766949,课程生动有趣，老师讲的很好。该课程对我的帮非常大，解答了我的疑惑。,0,5.0,1710407795057
6811804,本23医类1班27号熊壮,"首先，从课程内容来看，该课程涵盖了Python程序设计语言的基础知识，以及如何使用Python进行互联网数据的爬取、预处理、存储、可视化和简单数据分析。这样的内容设置不仅有助于学习者掌握Python编程技能，还能让他们了解数据分析的基本流程和方法，为后续的专业知识学习和工作实践打下坚实基础。

",0,5.0,1710407792306
6809898,mooc11409539107723095,妙啊，老师讲的真不错！从中获取了很多有用的知识，好耶！,0,5.0,1710407788829
6804991,mooc174117672827553390,老师的课堂真是太精彩了！讲解的内容既深刻又易懂，让我们对知识有了全新的认识。您的热情和耐心也极大地激发了我们的学习兴趣，感谢您的辛勤付出！,0,5.0,1710407784621
6806902,mooc11233831317383059,老师上课非常有耐心，生动形象，让我比较好理解，学到很多东西,0,5.0,1710407783444
6804990,mooc174023122723604916,老师讲的特别好，太棒了！,0,5.0,1710407780074
6804989,mooc11322674801221439,老师温柔，知识丰富，讲课生动有趣,0,5.0,1710407779836
6807902,学员3e89kada174624052898311837,老师讲的很好，每个点都具体详细，有问题老师还会及时耐心地给我们讲解解决，赞,0,5.0,1710407774382
6806901,EloiseSun,很有用的课程，让我很轻松地学习了python的爬取和可视化内容。受益匪浅，感受颇深。精品课程值得推荐。,0,5.0,1710407773863
6807901,风之务语,老师讲课认真，知识点讲解详细，是一门非常好的课程。,0,5.0,1710407754202
6806004,mooc2426553764063397,老师讲得很用心,0,5.0,1710407751131
6809897,mooc11343591098842268,老师讲的好好，课堂挺有趣，很有耐心,0,5.0,1710407750442
6807900,mooc62098972108724055,还可以的课程,0,5.0,1710407744825
6808850,mooc11324608924165109,内容详细，好理解，老师教授内容娓娓道来，节奏适中，非常好,0,5.0,1710407744524
6806898,繁华落尽k1212898866485480339,很好的课程 让我恍然大悟，不再是懵懂的小白了,0,5.0,1710407744158
6807899,mooc11405454690997013,老师讲的很不错，能够很快的运用,0,5.0,1710407744043
6807898,桃玊,老师讲课很好,0,5.0,1710407743370
6807897,♡cicelin,很好，非常好，看了之后很有收获。,0,5.0,1710407742924
6804988,医类02班徐胜威20230020212,学习路上的宝藏,0,5.0,1710407740926
6809896,刘允澄,"课程很好，内容精细，上课生动有趣
学到了真东西",0,5.0,1710407739312
6806003,学员ef5akada857056324372895,这个课程真的很好，讲的很详细,0,5.0,1710407735998
6808849,好好好好好好好棒,非常好，值得看，学习到了很多计算机知识,0,5.0,1710407734305
6806002,mooc11325151300151570,对大学生非常非常实用，使用体验很好，能够获得不少编程知识,0,5.0,1710407733410
6808848,-箴,虽然不是学计算机的但是老师真的人美心善教的好,0,5.0,1710407733358
6807896,廖佳钰ljy,在这门课中我学到了挺多东西的，老师教的很认真，很有经验，非常有意义的一门课，,0,5.0,1710407731436
6804987,本23级医类1班30号徐慧蓉,"很不错的课程！虽说是线上课程，但是学习效果丝毫不比线下课得效果差,我从中学到了很多！",0,5.0,1710407726661
6810882,刘墨轩20230020112,这课程嘎嘎好，真的懂了呢,0,5.0,1710407726380
6810881,颜松炜kada164792033675981991,老师讲解详细，零基础入门教程，适合初学者学习。,0,5.0,1710407720865
6806897,陶唧唧,太棒啦，老师耐心又细心，学生又不懂的问老师都会第一时间回复。上课也生动有趣。老师认真负责,0,5.0,1710407714070
6807895,iooov,非常实用，课程也很详细,0,5.0,1710407708625
6806001,学员3d2akada76305842027569004,对大学生非常实用，使用体验不错。,0,5.0,1710407705998
6806000,Ustiniank1293501755466314816,还行还行，做的很好,0,5.0,1710407703320
6804986,mooc11553642628795642,很好的网课。,0,5.0,1710407702481
6810880,mooc174020121880415628,老师讲的很棒，深入浅出,0,5.0,1710407687100
6807894,学员123123123123,很不错，非常好，特别棒，对大学生非常实用,0,5.0,1710407685216
6811803,忆朱颜,内容非常丰富，讲课很精彩！,0,5.0,1710407683853
6810879,defaultk12121312662837868788,有趣！好评！,0,5.0,1710407683695
6806895,mooc11426873259739444,很好的网课,0,5.0,1710407676028
6809894,本23医类02班7号张梓豪,非常好，很有用,0,5.0,1710407655745
6807893,粉红肉夹馍,这门课让我学到了许多，让我学到了一门技能,0,5.0,1710407644152
6807724,mooc28878382469756193,好太好了好好,0,5.0,1710312138099
6805824,入海k12130107588657572441,一门非常有趣实用的课程，帮助我们了解如何从网络上抓取数据，能提高自己的编程能力。,0,5.0,1710311921689
6804813,秋知一葉,老师人非常好，讲话温柔，教学有耐心，让我一个非专业的学生，都不知不觉爱上了这门课，感觉每一次课的作用都非常大，了。对代码充满了无限的向往，总之我非常喜欢这个老师……,0,5.0,1710311901174
6810712,老子明天不上班,good，非常好的一堂课，有很多收获，就算以后不会从事相关的工作，也会想接着学习一下,0,5.0,1710311786855
6808704,mooc10792474812520554,首先，对于python基础内容讲得很详细，其次老师实力也非常强悍，在和老师学习的过程当中也非常愉快，谈吐清晰，讲完之后我差不多就学完学好爬虫了，很棒,0,5.0,1710311757195
6810711,mooc115082209046778726,教师授课认真负责，讲课通俗易懂，易于理解，通过这次上课让我学会了很多,0,5.0,1710311755265
6810710,mooc65414714227771036,老师讲的很详细很有趣，非常棒,0,5.0,1710311753964
5018197,承少杰,老师讲的很好啊，逻辑清晰语气亲切，知识直接进脑子,0,5.0,1710311745402
6808703,学员20fakada109362133498277243,老师讲的特别详细和认真，令我实现从零到一的突破，非常感谢老师谆谆教诲！,0,5.0,1710311740569
6811633,朴西西的女朋友,"老师教的很好
",0,5.0,1710311731866
6810709,mooc28942310564269118,课程实用性高，开拓学生视野，了解到有关python的知识，这堂课很有意义，听后很受启发。总的说来，师生的精神面貌、学习氛围、课堂流程、目标落实、双基训练、德育渗透都做得比较好。,0,5.0,1710311716808
6805823,mooc10619257837549488,老师在非常认真的的给我们普及相关知识，并且讲的非常好，认真负责，让我们每一个人都能学会，让我们掌握了不仅是课程要求的内容。并且激发我们的兴趣让我们学的更多,0,5.0,1710311700981
6808702,学员28dbkada109704022715449243,在新的领域Python获取到新的认知。老师讲课非常好，认真负责。,0,5.0,1710311699294
6811631,mooc魏云鹏,学了爬虫感觉很有意思，实现小说自由啦！,0,5.0,1710311677999
6811630,学员55bakada78032004120173211,这门课程很有实用意义，让我了解了有关于Python的知识，使我对其拥有了很大兴趣。,0,5.0,1710311677886
6804811,mooc173408037661344124,老师讲的很详细，用实例进行讲解，让人很容易掌握,0,5.0,1710311677634
6806739,mooc28939925336551710,专业性强，上课有趣，非常适合我们的学习进度,0,5.0,1710311675437
6805822,WeiLai_Future,学习了好多python知识，课程很好。Python 在数据爬取和可视化方面的优势确实令人赞叹。首先，它有着强大的数据爬取库，如 BeautifulSoup 和 Scrapy，能够轻松地从网页上提取数据。其次，Python 在数据处理和分析方面拥有丰富的库，如 Pandas、NumPy 和 SciPy，使得数据清洗和分析变得更加简单和高效。,0,5.0,1710311667294
6807722,mooc10710038028492259,老师讲课思路清晰，通俗易懂，我受益匪浅。,0,5.0,1710311647070
6810708,王烨杓,网络爬虫在信息获取和数据分析中发挥着不可替代的作用，而Python作为一种简洁而强大的编程语言，为网络爬虫的开发提供了极大的便利。网络爬虫能够快速、自动地从互联网上收集数据，为研究、商业决策等提供支持。它们可以帮助我们获取各种类型的信息，包括新闻、社交媒体数据、产品信息等，为人们提供了更广阔的信息空间。同时，网络爬虫也在搜索引擎、电子商务等领域发挥着重要作用，为用户提供了更加便捷和丰富的信息服务。,0,5.0,1710311642654
6804810,mooc90667831124860296,Python作为一种流行的编程语言，在许多领域都有广泛的应用，包括数据分析、人工智能、网络开发等。学习Python课程可以帮助学生掌握这门语言，为将来的学习和工作打下坚实的基础。,0,5.0,1710311623061
6806738,洋洋洒洒k1228879043707138167,老师上课有趣生动，激发了我对Python语言的兴趣，真是太棒啦！,0,5.0,1710311603403
6806737,mooc10619216380694904,老师上课讲解细心，生动有趣，让我喜欢上了这门课程，获得了一些爬取知识，受益匪浅,0,5.0,1710311576937
6807721,mooc96244041075632145,感觉很有用，打开新世界的大门,0,5.0,1710311570673
6807720,追风赶月k129934705304402768,我觉得老师上课非常生动形象，很轻松，快乐的学习，也让我非常感兴趣！瞬间就有了想学着这个的兴趣,0,5.0,1710311569412
6811629,mooc33174514248559265,内容丰富有趣，教学内容实用性强，能使学生快速入门并能长期坚持,0,5.0,1710311569303
6810707,mooc4605591523416716,好评！好评！好评！,0,5.0,1710311555345
6807719,mooc12283631189166847,课程非常有趣,0,5.0,1710311538357
6809727,陈宇轩k1265394163744554746,老师讲课逻辑很清晰，说的很通俗，课堂氛围也很有意思。,0,5.0,1710311527811
6807718,happy_z,爬虫很好玩，孩子很喜欢,0,5.0,1710311501490
6810706,学员ef3bkada76466411751029701,老师讲的很棒,0,5.0,1710311485502
6809724,欧皇食府,非常好，下次还听,0,5.0,1710311485282
6805820,zzz凯,很有趣的课，对于我的计算机语法技能很有帮助。,0,5.0,1710311480938
6805819,mooc97903495084098592,很赞，不仅可以学到Python知识还有免费小说可以看,0,5.0,1710311460657
6811628,Fairwind01,好好好，很好很好很好,0,5.0,1710311447062
6806736,不吃南瓜的小王,好！超级喜欢老师！,0,5.0,1710311445756
6811627,mooc10617240899178708,上课氛围很活跃，老师讲的也很细致，灰常棒,0,5.0,1710311439511
6805818,mooc173407935528827971,课程讲解非常易懂，清楚。让我们在知识中畅游。,0,5.0,1710311414852
6804808,mooc96233135502585707,上课内容风趣幽默，Python基础教程讲解详细，知识好玩实用有趣,0,5.0,1710311411930
6810705,ykt34871275420043883,爬虫真的太酷了,0,5.0,1710311410806
6811626,k122225502621741593,很好的课堂氛围，老师教的很明白透彻，让我对Python充满兴趣，很透彻易懂的课程，爱来自南华~,0,5.0,1710311407789
6806735,mooc97212193154131841,好好好好好好好好好好好好好好,0,5.0,1710311396385
6807717,加肥这只猫,爬小说可真是太好啦！！,0,5.0,1710311389813
6806734,k1228939976337644599,老师上课十分细心，讲解的非常清楚，让我对于python的理解十分清晰，在我编程出现问题的时候悉心指导我怎么找出并且改正程序中的错误，非常感谢！,0,5.0,1710311389440
6809723,mooc12283695256373461,老师上课生动有趣，内容充实有用，知识结合性实用性强。,0,5.0,1710311388132
6807716,机械16何思远,"这真的是泰裤辣！！
",0,5.0,1710311379352
6808700,byxiiii,简明易懂。,0,5.0,1710311378127
6809722,mooc97365991220385745,讲的很详细，问题都可以得到解决，谁学都说好,0,5.0,1710311372291
6805817,WaNgYt.k1251884912056034820,上课能学到很多实用的python知识,0,5.0,1710311371371
6805816,mooc97211952536637129,很有趣，的确学到很多东西，对pytnon有了一定了解,0,5.0,1710311346991
